{
  "$schema": "../../schema/tip.schema.json",
  "id": "G06",
  "title": {
    "zh": "冠词 de / het / een，指示词 deze / dit / die / dat",
    "en": "Articles de / het / een; deze / dit / die / dat"
  },
  "body_zh": [
    "名词分 de 词和 het 词，大部分是 de 词。不定冠词都是 een；复数一律用 de。记名词时连冠词一起记：de keuken，het huis。",
    "“这个”：de 词用 deze，het 词用 dit；“那个”：de 词用 die，het 词用 dat。",
    "单独指东西时用 dit / dat：Dit is de keuken.（这是厨房。）",
    "指着几样东西时也用 dit / dat，动词用 zijn：Dit zijn de slaapkamers.（这些是卧室。）"
  ],
  "body_en": [
    "Nouns are de-words or het-words; most are de-words. The indefinite article is always een, and every plural takes de. Learn each noun with its article: de keuken, het huis.",
    "“This”: deze with de-words, dit with het-words; “that”: die with de-words, dat with het-words.",
    "To point at something on its own, use dit / dat: Dit is de keuken. (This is the kitchen.)",
    "When pointing at several things, also use dit / dat with the verb zijn: Dit zijn de slaapkamers. (These are the bedrooms.)"
  ],
  "examples": [
    {
      "id": "G06-X1",
      "nl": "Dit is de keuken.",
      "zh": "这是厨房。",
      "en": "This is the kitchen."
    },
    {
      "id": "G06-X2",
      "nl": "Deze slaapkamer is klein.",
      "zh": "这间卧室很小。",
      "en": "This bedroom is small."
    },
    {
      "id": "G06-X3",
      "nl": "Dat huis is ruim.",
      "zh": "那座房子很宽敞。",
      "en": "That house is spacious."
    }
  ],
  "pack_examples": ["NN23-X1"],
  "table": {
    "head": ["", "de 词", "het 词", "复数"],
    "rows": [
      ["定冠词", "de", "het", "de"],
      ["这", "deze", "dit", "deze"],
      ["那", "die", "dat", "die"]
    ]
  }
}
