{
  "$schema": "../../schema/tip.schema.json",
  "id": "G01",
  "title": {
    "zh": "人称代词",
    "en": "Personal pronouns"
  },
  "body_zh": [
    "“你”有两种：对熟人、朋友、孩子说 jij，对陌生人、长辈和在办事处说 u（您）。拿不准时用 u。",
    "很多代词有轻读形式：jij → je，wij → we，zij → ze。口语里轻读形式更常见，意思不变。",
    "zij / ze 既可以是“她”，也可以是“他们”，看后面的动词：zij is（她是），zij zijn（他们是）。",
    "在 met、voor 这类词后面，jij 说成 jou：Hoe gaat het met jou?（你好吗？）"
  ],
  "body_en": [
    "Dutch has two words for “you”: jij for friends, family and children, u for strangers, older people and officials. When in doubt, use u.",
    "Many pronouns have an unstressed form: jij → je, wij → we, zij → ze. In speech the short forms are more common.",
    "zij / ze means “she” or “they”; the verb tells you which: zij is (she is), zij zijn (they are).",
    "After words such as met and voor, jij becomes jou: Hoe gaat het met jou? (How are you?)"
  ],
  "examples": [
    {
      "id": "G01-X1",
      "nl": "Hoe gaat het met u?",
      "zh": "您好吗？",
      "en": "How are you? (formal)"
    },
    {
      "id": "G01-X2",
      "nl": "Hoe gaat het met jou?",
      "zh": "你好吗？",
      "en": "How are you? (informal)"
    },
    {
      "id": "G01-X3",
      "nl": "Wij wonen in Rotterdam.",
      "zh": "我们住在鹿特丹。",
      "en": "We live in Rotterdam."
    }
  ],
  "table": {
    "head": ["荷兰语", "中文", "轻读"],
    "rows": [
      ["ik", "我", ""],
      ["jij", "你", "je"],
      ["u", "您", ""],
      ["hij", "他", ""],
      ["zij", "她", "ze"],
      ["wij", "我们", "we"],
      ["jullie", "你们", ""],
      ["zij", "他们", "ze"]
    ]
  }
}
